{
	"$schema": "http://json-schema.org/draft-07/schema#",
	"type": "object",
	"additionalProperties": false,
	"properties": {
		"$schema": {
			"type": "string"
		},
		"grammarVersion": {
			"type": "string"
		},
		"schemaVersion": {
			"type": "string"
		},
		"sourceRoots": {
			"type": "array",
			"items": {
				"type": "string"
			}
		},
		"language": {
			"type": "string",
			"enum": ["typescript", "csharp", "python"]
		},
		"testFramework": {
			"type": "string",
			"enum": ["vitest", "xunit", "pytest"]
		},
		"generatedDir": {
			"type": "string"
		},
		"staleness": {
			"type": "object",
			"additionalProperties": false,
			"properties": {
				"blockOnStale": {
					"type": "boolean"
				}
			},
			"required": ["blockOnStale"]
		},
		"rejection": {
			"type": "object",
			"additionalProperties": false,
			"properties": {
				"idiom": {
					"type": "string",
					"enum": ["throws", "returns"]
				}
			}
		},
		"propertyBased": {
			"type": "object",
			"additionalProperties": false,
			"properties": {
				"enabled": {
					"type": "boolean"
				},
				"numRuns": {
					"type": "integer",
					"minimum": 1
				},
				"seed": {
					"type": "integer",
					"minimum": -2147483648,
					"maximum": 2147483647
				}
			},
			"required": ["enabled", "numRuns"]
		}
	},
	"required": [
		"sourceRoots",
		"language",
		"testFramework",
		"generatedDir",
		"staleness"
	]
}
